Sherrard Street Upper Dublin 1,1300,2019-02-06apartments-for-rent.csv
Castleforbes Dublin 1 Co. Dublin,1700,2019-02-06apartments-for-rent.csv
Vantage By Kennedy Wilson Central Park Leopardst Leopardstown Dublin 18,2300,2019-02-06apartments-for-rent.csv
Adelaide Square Dublin 8,2500,2019-02-06apartments-for-rent.csv
Drynam Avenue Drynam Hall Swords Co. Dublin,1800,2019-02-06apartments-for-rent.csv
Bellevue Avenue Booterstown Co. Dublin,2000,2019-02-06apartments-for-rent.csv
Belfry Grove Citywest Co. Dublin,1150,2019-02-06apartments-for-rent.csv
Bertram Court Lamb Alley Merchants Quay Dublin 8,1500,2019-02-06apartments-for-rent.csv
The Clayton The Gasworks Ringsend Dublin 4,1600,2019-02-06apartments-for-rent.csv
Parklands Northwood Santry Dublin 9,2000,2019-02-06apartments-for-rent.csv
Burnell Square Northern Cross Clarehall Dublin 17,2500,2019-02-06apartments-for-rent.csv
Cabra Park Cabra Dublin 7,2200,2019-02-06apartments-for-rent.csv
Prussia Street Stoneybatter Dublin 7,2000,2019-02-06apartments-for-rent.csv
146 Meridian Court Ashtown Ashtown Dublin 15,2650,2019-02-06apartments-for-rent.csv
Beacon South Quarter Sandyford Dublin 18,2800,2019-02-06apartments-for-rent.csv
Cranford Court Donnybrook Dublin 4,1550,2019-02-06apartments-for-rent.csv
Cherbury Court Booterstown Co. Dublin,2100,2019-02-06apartments-for-rent.csv
15 Linden Square Grove Avenue Blackrock Co. Dublin,2100,2019-02-06apartments-for-rent.csv
46 Rathmines Road Upper Rathmines D 6 Rathmines Dublin 6,1500,2019-02-06apartments-for-rent.csv
Garters Lane Saggart Co. Dublin,1800,2019-02-06apartments-for-rent.csv
Hampton Square Dublin 7,1800,2019-02-06apartments-for-rent.csv
62 North Strand Road North Strand Dublin 3,1500,2019-02-06apartments-for-rent.csv
College Gate Townsend St Dublin 2 Dublin 2,1728,2019-02-06apartments-for-rent.csv
Hybreasal House South Circular Road Kilmainham Dublin 8,1300,2019-02-06apartments-for-rent.csv
Fairhaven Strand Street ( In Heart Of Village) Malahide Co. Dublin,1600,2019-02-06apartments-for-rent.csv
57 Stapleton House 33 Mountjoy Square Dublin 1,1600,2019-02-06apartments-for-rent.csv
Ashwood House Mount Street Dublin 2 Grand Canal Dock Dublin 2,2100,2019-02-06apartments-for-rent.csv
No 45 The Elm Parkview Stepaside Dublin 18 Stepaside Dublin 18,2000,2019-02-06apartments-for-rent.csv
Grafton Hall 40 Aungier Street Dublin 2,1600,2019-02-06apartments-for-rent.csv
Ciderhurst Phoenix Park Racecourse Apartments Castleknock Dublin 15,1825,2019-02-06apartments-for-rent.csv
Rockwell Cove Blackrock Co. Dublin,2100,2019-02-06apartments-for-rent.csv
Linden Court Grove Avenue Blackrock Co. Dublin,1700,2019-02-06apartments-for-rent.csv
Canon Hall Dublin 1,1850,2019-02-06apartments-for-rent.csv
Rathbourne Court Ashtown Dublin 15,1795,2019-02-06apartments-for-rent.csv
6 Anley Court Lucan Co. Dublin,1794,2019-02-06apartments-for-rent.csv
The Plaza Ballymun Dublin 9,1600,2019-02-06apartments-for-rent.csv
Turvey Woods Donabate Co. Dublin,1520,2019-02-06apartments-for-rent.csv
Wyckham Place Dundrum Dublin 14,1750,2019-02-06apartments-for-rent.csv
Moynihan Court Tallaght Dublin 24,1800,2019-02-06apartments-for-rent.csv
Frankfort Avenue Rathmines Dublin 6,1500,2019-02-06apartments-for-rent.csv
6 Woodbrook Court Castleknock Dublin 15,2000,2019-02-06apartments-for-rent.csv
13 Torquay Kilgobbin Woods Sandyford Dublin 18,2100,2019-02-06apartments-for-rent.csv
The William Bligh The Gasworks Barrow Street Ringsend Dublin 4,2800,2019-02-06apartments-for-rent.csv
Baggot Rath House Newbridge Ave Ballsbridge Dublin 4,5460,2019-02-06apartments-for-rent.csv
Baggoth Rath Newbridge Avenue Ballsbridge Dublin 4,4200,2019-02-06apartments-for-rent.csv
Baggotrath House Newbridge Ave Ballsbridge Dublin 4,3360,2019-02-06apartments-for-rent.csv
Blackthorn Drive Sandyford Dublin 18,4760,2019-02-06apartments-for-rent.csv
Heather Court Stepaside Park Stepaside Dublin 18,2000,2019-02-06apartments-for-rent.csv
Ashley Hall Lucan Co. Dublin,1456,2019-02-06apartments-for-rent.csv
St Raphael'S Road Sandyford Dublin 18,2700,2019-02-06apartments-for-rent.csv
Emmet Court Inchicore Dublin 8,1600,2019-02-06apartments-for-rent.csv
Chapel Gate Drumcondra Dublin 9,2300,2019-02-06apartments-for-rent.csv
88 Fitzwilliam Quay Ringsend Dublin 4,2200,2019-02-06apartments-for-rent.csv
1 Hampton Court Bloomfield Avenue Donnybrook Dublin 4,1755,2019-02-06apartments-for-rent.csv
Milners Square Santry Dublin 9,1700,2019-02-06apartments-for-rent.csv
21 Rosehaven Carpenterstown Dublin 15,1800,2019-02-06apartments-for-rent.csv
69 Windmill Lane Dublin 2,2000,2019-02-06apartments-for-rent.csv
Clarion Quay Mayor Street Ifsc Ifsc Dublin 1,2800,2019-02-06apartments-for-rent.csv
36 Summerseat Drive Clonee Dublin 15,1600,2019-02-06apartments-for-rent.csv
Sorrento Heights Sorrento Rd Dalkey Co. Dublin,3450,2019-02-06apartments-for-rent.csv
Trinity Square Lombard Street Dublin 2,1560,2019-02-06apartments-for-rent.csv
Santry Avenue Ballymun Dublin 9,1950,2019-02-06apartments-for-rent.csv
(2) Tallaght Cross East Tallaght Dublin 24,1550,2019-02-06apartments-for-rent.csv
Aranmore Custom House Harbour I.F.S.C Dublin 1,2100,2019-02-06apartments-for-rent.csv
Charlotte Apartments Dun Laoghaire Co. Dublin,1950,2019-02-06apartments-for-rent.csv
Robswall Malahide Co. Dublin,1375,2019-02-06apartments-for-rent.csv
Boyne Court Harold'S Cross Dublin 6,1455,2019-02-06apartments-for-rent.csv
Woodvale Lawn Clonsilla Dublin 15,1700,2019-02-06apartments-for-rent.csv
Monkstown Valley Monkstown Co. Dublin,1670,2019-02-06apartments-for-rent.csv
Glen Arm Square Dargle Road Drumcondra Dublin 9,1295,2019-02-06apartments-for-rent.csv
Mayor Street Dublin 1,980,2019-02-06apartments-for-rent.csv
Mayor Street Ifsc Dublin 1,980,2019-02-06apartments-for-rent.csv
Apt. 16 Drury Hall Lower Stephen'S Street Dublin 2,1850,2019-02-06apartments-for-rent.csv
15 Willsborough Clonshaugh Dublin 17,1550,2019-02-06apartments-for-rent.csv
Pelletstown Avenue Royal Canal Park Dublin 15,1800,2019-02-06apartments-for-rent.csv
17 Bellevue Court Dornden Park Booterstown Blac Booterstown Co. Dublin,1880,2019-02-06apartments-for-rent.csv
Finsbury House 79,2500,2019-02-06apartments-for-rent.csv
Shanganagh Terrace Killiney Co. Dublin,1500,2019-02-06apartments-for-rent.csv
150 Wyckham Point Dundrum Dublin 14,2000,2019-02-06apartments-for-rent.csv
Railway Road Dalkey Co. Dublin,2250,2019-02-06apartments-for-rent.csv
William Beckett House Dublin 2,2000,2019-02-06apartments-for-rent.csv
26 Lower Ormond Quay Dublin 1,2650,2019-02-06apartments-for-rent.csv
Swords Road Santry Dublin 9,1300,2019-02-06apartments-for-rent.csv
Rochfort House Dean Court Patrick Street Dublin 8,1799,2019-02-06apartments-for-rent.csv
Bishop Street Dublin 2,1350,2019-02-06apartments-for-rent.csv
100 The Marker Residences Grand Canal Dock Dublin 2,3500,2019-02-06apartments-for-rent.csv
52 Merrion Square East Dublin 2,2950,2019-02-06apartments-for-rent.csv
Belgrove Park Mount Prospect Road Clontarf Dublin 3,1990,2019-02-06apartments-for-rent.csv
Apartment 52 Salthill Seapoint Avenue Monkstown Co. Dublin,2700,2019-02-06apartments-for-rent.csv
35 Sycamore Trimbleston Apartments Clonskeagh Goatstown Dublin 14,2200,2019-02-06apartments-for-rent.csv
8 Harcourt Hall Charlotte Way Dublin 2,2200,2019-02-06apartments-for-rent.csv
Neptune Apartments Dun Laoghaire Co. Dublin,2091,2019-02-06apartments-for-rent.csv
Neptune Apartments Dun Laoghaire Co. Dublin,2151,2019-02-06apartments-for-rent.csv
The Hibernian The Gasworks Ringsend Dublin 4,4050,2019-02-06apartments-for-rent.csv
The Hibernian The Gasworks Ringsend Dublin 4,3450,2019-02-06apartments-for-rent.csv
Penthouse Apartment Intercontinental Hotel Ballsbridge Dublin 4,6500,2019-02-06apartments-for-rent.csv
Spencer Dock Apartments Dublin 1,4500,2019-02-06apartments-for-rent.csv
24 The Mall Ongar Dublin 15 Ongar Dublin 15,1700,2019-02-06apartments-for-rent.csv
20 Hampton Wood Road Finglas Dublin 11,1850,2019-02-06apartments-for-rent.csv
Abbey Glen Cabinteely Dublin 18,1900,2019-02-06apartments-for-rent.csv
Watermill Road Raheny Dublin 5,1800,2019-02-06apartments-for-rent.csv
177 Bushy Park House Terenure Terenure Dublin 6W,2100,2019-02-06apartments-for-rent.csv
Mellor Court Dublin 1,2500,2019-02-06apartments-for-rent.csv
68 Mount Talbot Highgrove Clondalkin Clondalkin Dublin 22,1795,2019-02-06apartments-for-rent.csv
The Crescent Building Park West Dublin 12,1395,2019-02-06apartments-for-rent.csv
Ifsc Custom House Harbour Dublin 1,1795,2019-02-06apartments-for-rent.csv
Belfry Road Citywest Co. Dublin,1350,2019-02-06apartments-for-rent.csv
Newtown Oldtown Ballyboughal Ballyboughal Co. Dublin,1040,2019-02-06apartments-for-rent.csv
22 Dawson Street Dublin 2,4500,2019-02-06apartments-for-rent.csv
St James Rd Greenhills Dublin 12,1950,2019-02-06apartments-for-rent.csv
St James Rd Greenhills Dublin 12,1750,2019-02-06apartments-for-rent.csv
5 Ostman Wood Old Co. Road Crumlin Crumlin Dublin 12,1350,2019-02-06apartments-for-rent.csv
Maystown Charlestown Beside Ikea Finglas Dublin 11,1950,2019-02-06apartments-for-rent.csv
Tuskar Rock Custom House Harbour Dublin 1,1600,2019-02-06apartments-for-rent.csv
Sussex Terrace Elm House Mespil Estate Dublin 4,1750,2019-02-06apartments-for-rent.csv
Inglenook Wood Carrickmines Dublin 18,2200,2019-02-06apartments-for-rent.csv
Adelaide Square Wood Street Dublin 2,2300,2019-02-06apartments-for-rent.csv
Belcamp Hutchison Carrs Lane Balgriffin Dublin 13,950,2019-02-06apartments-for-rent.csv
Castle Street Dublin 2,2400,2019-02-06apartments-for-rent.csv
Spencer House Ifsc Dublin 1,2100,2019-02-06apartments-for-rent.csv
17 Blessington Street Dublin 1 Dublin 1,2700,2019-02-06apartments-for-rent.csv
Castleforbes Square Dublin 1,2200,2019-02-06apartments-for-rent.csv
Gracepark Manor Drumcondra Dublin 3,3180,2019-02-06apartments-for-rent.csv
