Tfe Talbot Street Dublin 1,1350,2019-02-06studio-apartments-for-rent.csv
Blessington Street Dublin 1,1300,2019-02-06studio-apartments-for-rent.csv
Whitworth Road Drumcondra D9 Glasnevin Dublin 9,1300,2019-02-06studio-apartments-for-rent.csv
14 Grosvenor Road Rathmines Rathmines Dublin 6,900,2019-02-06studio-apartments-for-rent.csv
Phoenix Gate North Circular Road Dublin 7,1124,2019-02-06studio-apartments-for-rent.csv
Stillorgan Park Avenue Stillorgan Co. Dublin,1650,2019-02-06studio-apartments-for-rent.csv
Boolavogue Road East Wall Dublin 3,1500,2019-02-06studio-apartments-for-rent.csv
Spencer Street North North Strand Dublin 3,900,2019-02-06studio-apartments-for-rent.csv
Kenilworth Park Harold'S Cross Dublin 6W,950,2019-02-06studio-apartments-for-rent.csv
Leinster Road Rathmines Dublin 6,1100,2019-02-06studio-apartments-for-rent.csv
O'Hara Ave Harold'S Cross Dublin 6,1395,2019-02-06studio-apartments-for-rent.csv
Harrington Street Dublin 8,1200,2019-02-06studio-apartments-for-rent.csv
Dun Laoghaire Monkstown Co. Dublin,760,2019-02-06studio-apartments-for-rent.csv
Carrickhill Portmarnock Co. Dublin,680,2019-02-06studio-apartments-for-rent.csv
Finglas East Glasnevin Dublin 11,740,2019-02-06studio-apartments-for-rent.csv
Hatch Street Lower Dublin 2,1600,2019-02-06studio-apartments-for-rent.csv
Hatch Street Lower Dublin 2,1700,2019-02-06studio-apartments-for-rent.csv
Victoria Street Portobello Dublin 8,1330,2019-02-06studio-apartments-for-rent.csv
Terenure Road East Terenure Dublin 6,1339,2019-02-06studio-apartments-for-rent.csv
Ranelagh Road Ranelagh Dublin 6,1395,2019-02-06studio-apartments-for-rent.csv
Grove Park Rathmines Dublin 6,1122,2019-02-06studio-apartments-for-rent.csv
Lower Rathmines Road Rathmines Dublin 6,1262,2019-02-06studio-apartments-for-rent.csv
The Colonnade Milltown Road Dublin 6 Milltown Dublin 6,650,2019-02-06studio-apartments-for-rent.csv
8 The Turrets Rathmines Dublin 6,933,2019-02-06studio-apartments-for-rent.csv
North Great Georges Street Dublin 1,895,2019-02-06studio-apartments-for-rent.csv
Room 13 28 Leinster Square Rathmines Dublin 6 Rathmines Dublin 6,1300,2019-02-06studio-apartments-for-rent.csv
Seville Place Dublin 1,1200,2019-02-06studio-apartments-for-rent.csv
Woodview Heights Lucan Co. Dublin,1250,2019-02-06studio-apartments-for-rent.csv
Pembroke Road Ballsbridge Dublin 4,1200,2019-02-06studio-apartments-for-rent.csv
North Circular Road Dublin 7,1250,2019-02-06studio-apartments-for-rent.csv
Victoria Street Portobello Dublin 8,950,2019-02-06studio-apartments-for-rent.csv
Earlsfort Gardens Lucan Co. Dublin,1000,2019-02-06studio-apartments-for-rent.csv
North Strand Road North Strand Dublin 3,880,2019-02-06studio-apartments-for-rent.csv
Portobello South Circular Road Dublin 8,1080,2019-02-06studio-apartments-for-rent.csv
Victoria Street Portobello Dublin 8,1200,2019-02-06studio-apartments-for-rent.csv
North Circular Road Phibsborough Dublin 7,832,2019-02-06studio-apartments-for-rent.csv
218 South Circular Road South Circular Road Dublin 8,1200,2019-02-06studio-apartments-for-rent.csv
96 North Circular Road North Circular Road Dublin 7,1150,2019-02-06studio-apartments-for-rent.csv
Phibsborough Phibsborough Dublin 7,1200,2019-02-06studio-apartments-for-rent.csv
Mespil Estate Dubllin 4 Donnybrook Dublin 4,1550,2019-02-06studio-apartments-for-rent.csv
Sussex Terrace Donnybrook Dublin 4,2100,2019-02-06studio-apartments-for-rent.csv
Lower Rathmines Road Rathmines Dublin 6,1000,2019-02-06studio-apartments-for-rent.csv
1 Howth Road Clontarf Dublin 3,1250,2019-02-06studio-apartments-for-rent.csv
Cabra Park Phibsborough Dublin 7,1150,2019-02-06studio-apartments-for-rent.csv
Forest Close Kingswood Dublin 22,1200,2019-02-06studio-apartments-for-rent.csv
Flat 5 Phibsborough Dublin 7,1100,2019-02-06studio-apartments-for-rent.csv
Annesley Bridge Road North Strand Fairview Dublin 3,1200,2019-02-06studio-apartments-for-rent.csv
Malborough Mews Dublin 7,1025,2019-02-06studio-apartments-for-rent.csv
Harolds Cross Road Harold'S Cross Dublin 6W,1100,2019-02-06studio-apartments-for-rent.csv
Grosvenor Place Rathmines Dublin 6,1300,2019-02-06studio-apartments-for-rent.csv
Annesley Bridge Road North Strand Dublin 3,1200,2019-02-06studio-apartments-for-rent.csv
Fitzwilliam Street Lower Dublin 2,1190,2019-02-06studio-apartments-for-rent.csv
Rathgar Avenue Rathgar Dublin 6,1100,2019-02-06studio-apartments-for-rent.csv
Leinster Square Rathmines Dublin 6,1040,2019-02-06studio-apartments-for-rent.csv
Belgrave Terrace Rathmines Dublin 6,936,2019-02-06studio-apartments-for-rent.csv
Beechwood Av Lr Ranelagh Dublin 6,900,2019-02-06studio-apartments-for-rent.csv
Cabra Road Phibsborough Dublin 7,690,2019-02-06studio-apartments-for-rent.csv
Cabra Park Phibsborough Dublin 7,825,2019-02-06studio-apartments-for-rent.csv
Fairview Avenue Lower Fairview Dublin 3,1000,2019-02-06studio-apartments-for-rent.csv
Cedarbrook Place Parkwest Dublin 12 Park West Co. Dublin,1290,2019-02-06studio-apartments-for-rent.csv
460 South Circular Road Rialto Dublin 8,935,2019-02-06studio-apartments-for-rent.csv
Goldsmith Street Phibsborough Phibsborough Dublin 7,1050,2019-02-06studio-apartments-for-rent.csv
50 Irishtown Road Irishtown Dublin 4,1200,2019-02-06studio-apartments-for-rent.csv
20 Capel Street Dublin 1,900,2019-02-06studio-apartments-for-rent.csv
Synge Street Portobello Dublin 8,980,2019-02-06studio-apartments-for-rent.csv
Knockfield Manor 8 Knocklyon Dublin 16,1000,2019-02-06studio-apartments-for-rent.csv
Coundon Court Killiney Co. Dublin,1000,2019-02-06studio-apartments-for-rent.csv
Pembroke Place Dublin 2,1200,2019-02-06studio-apartments-for-rent.csv
North Circular Road Phibsborough Dublin 7,900,2019-02-06studio-apartments-for-rent.csv
9 Upper Buckingham Street Dublin 1,960,2019-02-06studio-apartments-for-rent.csv
Cabra Park Dublin 7,900,2019-02-06studio-apartments-for-rent.csv
Sussex Road Ballsbridge Dublin 4,1550,2019-02-06studio-apartments-for-rent.csv
