Bayview Avenue North Strand Dublin 3,1650,2019-02-06apartments-for-rent.csv
Custom House Square Ifsc Dublin 1,2000,2019-02-06apartments-for-rent.csv
Dublin Road Swords Co. Dublin,1200,2019-02-06apartments-for-rent.csv
The Richmond North Brunswick Street Smithfield Dublin 7,2100,2019-02-06apartments-for-rent.csv
Windmill Terrace Clonsilla Dublin 15,1400,2019-02-06apartments-for-rent.csv
Custom House Square Ifsc Dublin 1,1800,2019-02-06apartments-for-rent.csv
Castleside Rathfarnham Dublin 14,1250,2019-02-06apartments-for-rent.csv
Grattan Hall Grand Canal Dock Dublin 2,2500,2019-02-06apartments-for-rent.csv
La Rochelle Christchurch Dublin 8,2000,2019-02-06apartments-for-rent.csv
Blackthorn Hill View Rathcoole Co. Dublin,1356,2019-02-06apartments-for-rent.csv
Castleknock Park Castleknock Dublin 15,1600,2019-02-06apartments-for-rent.csv
Millrace Green Saggart Co. Dublin,1500,2019-02-06apartments-for-rent.csv
Wellington Quay Temple Bar Dublin 2,2100,2019-02-06apartments-for-rent.csv
Lansdowne Hall Naas Road Inchicore Dublin 8,1750,2019-02-06apartments-for-rent.csv
Old Nangor Road Clondalkin Dublin 22,1875,2019-02-06apartments-for-rent.csv
The Granary Dublin 8,1716,2019-02-06apartments-for-rent.csv
Cedar Lodge Farmleigh Castleknock Dublin 15,1600,2019-02-06apartments-for-rent.csv
Hatch Place Dublin 2,1800,2019-02-06apartments-for-rent.csv
Belfry Drive Citywest Co. Dublin,1800,2019-02-06apartments-for-rent.csv
Kilmore House Spencer Dock Dublin 1,2500,2019-02-06apartments-for-rent.csv
Hampton Wood Drive Finglas Dublin 11,1600,2019-02-06apartments-for-rent.csv
Parkgate Place Islandbridge Dublin 8,2800,2019-02-06apartments-for-rent.csv
Saunders House Spencer Dock Dublin 1,3000,2019-02-06apartments-for-rent.csv
The Richmond North Brunswick Street Smithfield Dublin 1,2100,2019-02-06apartments-for-rent.csv
Oatfield Clondalkin Dublin 22,1750,2019-02-06apartments-for-rent.csv
Gandon Hall Gardiner Street Dublin 1,1700,2019-02-06apartments-for-rent.csv
Meadow Copse Blanchardstown Dublin 15,950,2019-02-06apartments-for-rent.csv
New Seskin Court Tallaght Dublin 24,1900,2019-02-06apartments-for-rent.csv
Eaton Terrace Rathcoole Co. Dublin,1250,2019-02-06apartments-for-rent.csv
Jervis Place Dublin 1,2200,2019-02-06apartments-for-rent.csv
Hazelgrove Court Tallaght Dublin 24 Tallaght Dublin 24,1200,2019-02-06apartments-for-rent.csv
Lanesborough Square Finglas Dublin 11,1550,2019-02-06apartments-for-rent.csv
Kings Court Dublin 1,1950,2019-02-06apartments-for-rent.csv
Bushy Park House Terenure Dublin 6W,2700,2019-02-06apartments-for-rent.csv
Liberty Court Clanbrassil Street Dublin 8,1535,2019-02-06apartments-for-rent.csv
Milltown Avenue Milltown Dublin 6,2050,2019-02-06apartments-for-rent.csv
Carrickmines Wood Foxrock Dublin 18,2600,2019-02-06apartments-for-rent.csv
Haddington Ballsbridge Dublin 4,1800,2019-02-06apartments-for-rent.csv
Temple Hall Milltown Dublin 6,2450,2019-02-06apartments-for-rent.csv
Iveagh Court Harcourt Dublin 2,2500,2019-02-06apartments-for-rent.csv
Studio Harcourt Lane Dublin 2,1475,2019-02-06apartments-for-rent.csv
Mount Saint Annes Milltown Dublin 6,2450,2019-02-06apartments-for-rent.csv
Harcourt Lane Dublin 2,2500,2019-02-06apartments-for-rent.csv
Herbert Park Lane Ballsbridge Dublin 4,2150,2019-02-06apartments-for-rent.csv
Joyce Hall Carrickmines Wood Foxrock Dublin 18,2600,2019-02-06apartments-for-rent.csv
The Bridge Shankill Dublin 18,2000,2019-02-06apartments-for-rent.csv
Rathgar Road Rathgar Dublin 6,1900,2019-02-06apartments-for-rent.csv
Radcliff HallSt Johns Road Sandymount Dublin 4,3250,2019-02-06apartments-for-rent.csv
49 Killiney Hill Park Killiney Co. Dublin,1866,2019-02-06apartments-for-rent.csv
Valentia House Phibsborough Dublin 7,1500,2019-02-06apartments-for-rent.csv
Apt 32 Northumberland Place Grand Canal Street Dublin 4,2400,2019-02-06apartments-for-rent.csv
32 The Coombe The Coombe Dublin 8,2500,2019-02-06apartments-for-rent.csv
Bowbridge Place Kilmainham Dublin 8,2000,2019-02-06apartments-for-rent.csv
Baileys Court Baileys Row Dublin 1,2000,2019-02-06apartments-for-rent.csv
Mountfield Park Malahide Co. Dublin,1600,2019-02-06apartments-for-rent.csv
Harcourt Lodge Inchicore Dublin 8,1800,2019-02-06apartments-for-rent.csv
Pines Apartments Herbert Park Lane Ballsbridge Dublin 4,2600,2019-02-06apartments-for-rent.csv
Bushy Park House Terenure Dublin 6W,1643,2019-02-06apartments-for-rent.csv
Smithfield Lofts North King Street Dublin 7. Smithfield Dublin 7,2200,2019-02-06apartments-for-rent.csv
Adelaide Square Dublin 2,3700,2019-02-06apartments-for-rent.csv
Mayor Street Lower Dublin 1,2760,2019-02-06apartments-for-rent.csv
Pembroke Row Dublin 2,3960,2019-02-06apartments-for-rent.csv
Alexandra Walk Dublin 2,3940,2019-02-06apartments-for-rent.csv
Alexandra Walk Dublin 2,3320,2019-02-06apartments-for-rent.csv
Adelaide Square Penthouse Dublin 2,4500,2019-02-06apartments-for-rent.csv
Red Court Oaks Seafield Road Clontarf Dublin 3,1880,2019-02-06apartments-for-rent.csv
Merrion Court Ailesbury Road Ballsbridge Dublin 4,2802,2019-02-06apartments-for-rent.csv
Grand Canal Wharf South Dock Street Ringsend Dublin 4,3750,2019-02-06apartments-for-rent.csv
Kirpatrick House Spencer Dock Dublin 1,2600,2019-02-06apartments-for-rent.csv
Railway House Malahide Co. Dublin,1650,2019-02-06apartments-for-rent.csv
Mountfield Park Malahide Malahide Co. Dublin,1900,2019-02-06apartments-for-rent.csv
The Bottleworks Ringsend Dublin 4,2000,2019-02-06apartments-for-rent.csv
Temple House Temple Street West Dublin 7,1700,2019-02-06apartments-for-rent.csv
The Sweepstakes Ballsbridge Dublin 4,1988,2019-02-06apartments-for-rent.csv
The Elms Mount Merrion Avenue Blackrock Co. Dublin,2100,2019-02-06apartments-for-rent.csv
Beacon South Quarter Sandyford Dublin 18,2796,2019-02-06apartments-for-rent.csv
Kill Avenue Dun Laoghaire Co. Dublin,1950,2019-02-06apartments-for-rent.csv
Castle Lawn Kilgobbin Wood Sandyford Dublin 18,1790,2019-02-06apartments-for-rent.csv
The Court Killiney Station Road Killiney Co. Dublin,2500,2019-02-06apartments-for-rent.csv
Batchelors Walk Apartments Dublin 2,2500,2019-02-06apartments-for-rent.csv
Cairnbrook Glenamuck Road Sandyford Dublin 18,2400,2019-02-06apartments-for-rent.csv
Cubes 6 Beacon South Quarter Sandyford Dublin 18,2200,2019-02-06apartments-for-rent.csv
Rochfort House Brennanstown Cabinteely Dublin 18,1850,2019-02-06apartments-for-rent.csv
One Beacon Beacon Hotel Sandyford Dublin 18,2500,2019-02-06apartments-for-rent.csv
Convent Hall Penthouse Mount Saint Annes Milltown Dublin 6,2950,2019-02-06apartments-for-rent.csv
The Newman The Court Station Road Killiney Co. Dublin,3500,2019-02-06apartments-for-rent.csv
Killiney Court Apartments Killiney Co. Dublin,3500,2019-02-06apartments-for-rent.csv
Cowper Hall Mount Saint Annes Milltown Dublin 6,2400,2019-02-06apartments-for-rent.csv
Milltown Hall Mount Saint Annes Milltown Dublin 6,2300,2019-02-06apartments-for-rent.csv
Killiney Court Apartments Killiney Dun Laoghaire Co. Dublin,2700,2019-02-06apartments-for-rent.csv
Aylmer Drive Newcastle Co. Dublin,1800,2019-02-06apartments-for-rent.csv
Rathgar Road Rathgar Dublin 6,1850,2019-02-06apartments-for-rent.csv
Apt 75 Shieling Sq Howth Road Raheny Dublin 5 Raheny Dublin 5,2650,2019-02-06apartments-for-rent.csv
Castleforbes Square Ifsc Dublin 1,2200,2019-02-06apartments-for-rent.csv
Fernbank Dundrum Dublin 14,2350,2019-02-06apartments-for-rent.csv
6 Sandycove House Newtownsmith Sandycove Co. Dublin,2600,2019-02-06apartments-for-rent.csv
Apt.43 The Dock Mill Barrow Street Dublin 4,2400,2019-02-06apartments-for-rent.csv
Hollybrook Foxrock Dublin 18,2950,2019-02-06apartments-for-rent.csv
Thornwood Apartments Booterstown Avenue Booterstown Co. Dublin,2080,2019-02-06apartments-for-rent.csv
Woodhaven Milltown Bridge Road Milltown Dublin 6,2400,2019-02-06apartments-for-rent.csv
Neptune House  Temple Crescent Blackrock Co. Dublin,7500,2019-02-06apartments-for-rent.csv
Neptune House  Temple Crescent Blackrock Co. Dublin,6000,2019-02-06apartments-for-rent.csv
Cooleen Avenue Beaumont Dublin 9,1000,2019-02-06apartments-for-rent.csv
49 Sydney Parade Sandymount Dublin 4,1990,2019-02-06apartments-for-rent.csv
Moeran Road Walkinstown Dublin 12,1150,2019-02-06apartments-for-rent.csv
Stewart Hall Ryders Row Parnell Street Dublin 1,1450,2019-02-06apartments-for-rent.csv
The Watermill Raheny Dublin 5,2000,2019-02-06apartments-for-rent.csv
Baltrasna House Spencer Dock Ifsc Dublin 1,2500,2019-02-06apartments-for-rent.csv
Venetian Hall Killester Dublin 3,1800,2019-02-06apartments-for-rent.csv
Timbermill Apartments Kilmore Road Artane Dublin 5,1850,2019-02-06apartments-for-rent.csv
Belfield Park Mount Merrion Co. Dublin,1995,2019-02-06apartments-for-rent.csv
Shrewsbury Square Ballsbridge Dublin 4,2650,2019-02-06apartments-for-rent.csv
Shelbourne Village Ringsend Dublin 4,2050,2019-02-06apartments-for-rent.csv
Kirkwood Park Avenue Sandymount Dublin 4,1900,2019-02-06apartments-for-rent.csv
Galloping Green Stillorgan Road Stillorgan Co. Dublin,1900,2019-02-06apartments-for-rent.csv
Balnagowan Palmerstown Park Rathmines Dublin 6,2300,2019-02-06apartments-for-rent.csv
Killiney Hill Park Killiney Hill Road Killiney Co. Dublin,1750,2019-02-06apartments-for-rent.csv
The Rectory Stepaside Dublin 18,1850,2019-02-06apartments-for-rent.csv
Carrig House Carrickbrennan Road Monkstown Co. Dublin,1450,2019-02-06apartments-for-rent.csv
Botanic Road Glasnevin Dublin 9,2600,2019-02-06apartments-for-rent.csv
Cross Avenue Blackrock Blackrock Co. Dublin,2028,2019-02-06apartments-for-rent.csv
Esker Manor Lucan Co. Dublin,1525,2019-02-06apartments-for-rent.csv
Lagan House Custom House Square Ifsc Dublin 1,2280,2019-02-06apartments-for-rent.csv
Main Street Clongriffin Dublin 13,1750,2019-02-06apartments-for-rent.csv
Collegefort Castleknock Dublin 15,1650,2019-02-06apartments-for-rent.csv
Beaucourt Achill Road Drumcondra Dublin 9,1450,2019-02-06apartments-for-rent.csv
Terenure Road West Terenure Dublin 6,2950,2019-02-06apartments-for-rent.csv
Apartment 88 Sandymount Road Sandymount Dublin 4,2850,2019-02-06apartments-for-rent.csv
Glenville Drive Blanchardstown Dublin 15,2000,2019-02-06apartments-for-rent.csv
Beechwood Court Stillorgan Co. Dublin,1600,2019-02-06apartments-for-rent.csv
Parklands Court Firhouse Dublin 24,1550,2019-02-06apartments-for-rent.csv
27 Ballintyre Grove Ballintyre Hall Ballinteer Dublin 16,1500,2019-02-06apartments-for-rent.csv
College View Ballymun Dublin 9,1800,2019-02-06apartments-for-rent.csv
Walkinstown Crescent Walkinstown Dublin 12,1150,2019-02-06apartments-for-rent.csv
Beechdale Court Ballycullen Dublin 24,1600,2019-02-06apartments-for-rent.csv
Bowbridge Place Kilmainham Dublin 8,2700,2019-02-06apartments-for-rent.csv
Rathgar Court 18,2000,2019-02-06apartments-for-rent.csv
Bridgefoot Street Dublin 8,1500,2019-02-06apartments-for-rent.csv
Allendale Square Clonsilla Dublin 15,1770,2019-02-06apartments-for-rent.csv
Hazel Lodge Castleside Drive Rathfarnham Dublin 14,1800,2019-02-06apartments-for-rent.csv
The Oaks Rockfield Dundrum Dublin 16,2200,2019-02-06apartments-for-rent.csv
Mountjoy Square East Dublin 1,1400,2019-02-06apartments-for-rent.csv
Windmill Lane,2000,2019-02-06apartments-for-rent.csv
123 Parklands Block 3 Northwood Santry D9 Santry Dublin 9,1800,2019-02-06apartments-for-rent.csv
Wicklow Court South Great Georges Street Dublin 2,1850,2019-02-06apartments-for-rent.csv
Rialto Court Rialto Dublin 8,1700,2019-02-06apartments-for-rent.csv
Jervis Place Jervis Street Dublin 7,1575,2019-02-06apartments-for-rent.csv
Waterside Block D Ballsbridge Dublin 4 Dublin 4,1945,2019-02-06apartments-for-rent.csv
James Street Dublin 8,1550,2019-02-06apartments-for-rent.csv
The Schooner Arran Quay Dublin 7,1550,2019-02-06apartments-for-rent.csv
2 The Aylesbury Donnybrook Castle Donnybrook Dublin 4,2150,2019-02-06apartments-for-rent.csv
The Pines Rockford Manor Blackrock Co. Dublin,1924,2019-02-06apartments-for-rent.csv
Lombard St. Trinity College Silicon Docks Dublin 2,2000,2019-02-06apartments-for-rent.csv
Harcourt Lodge Southern Cross Avenue Dublin 8 Inchicore Dublin 8,1450,2019-02-06apartments-for-rent.csv
Spencer Dock Dublin 1,2400,2019-02-06apartments-for-rent.csv
Mobhi Apartments Mobhi Road Drumcondra Dublin 9,1580,2019-02-06apartments-for-rent.csv
South Lotts Rd Dublin 4,2450,2019-02-06apartments-for-rent.csv
The Penthouses At Custom House Square Docklands Dublin 1,4200,2019-02-06apartments-for-rent.csv
Belfry Manor Citywest Co. Dublin,1550,2019-02-06apartments-for-rent.csv
1 Kilmore Santry Cross Santry Avenue Santry Dublin 9,2200,2019-02-06apartments-for-rent.csv
Idrone Terrace Blackrock Co. Dublin,2250,2019-02-06apartments-for-rent.csv
Kingsmill Court Bolton Street Dublin 1,1500,2019-02-06apartments-for-rent.csv
56 Timber Mill Artane Dublin 5,1700,2019-02-06apartments-for-rent.csv
Levmoss The Gallops Leopardstown Dublin 18,2400,2019-02-06apartments-for-rent.csv
Ailesbury Road Merrion Dublin 4,7500,2019-02-06apartments-for-rent.csv
Longford House Spencer Dock Ifsc Dublin 1,2800,2019-02-06apartments-for-rent.csv
De Vesci Court Monkstown Co. Dublin,2600,2019-02-06apartments-for-rent.csv
Mount Anvil Road Mount Merrion Co. Dublin,2150,2019-02-06apartments-for-rent.csv
109 Parnell Street Dublin 1,1450,2019-02-06apartments-for-rent.csv
Apt 40 Willow Ridge Hall Shangannagh Road Ballybrack Co. Dublin,2400,2019-02-06apartments-for-rent.csv
Apartment 61 Redwood Ridgehall Ballybrack Glena Ballybrack Co. Dublin,1900,2019-02-06apartments-for-rent.csv
Carrigmore Place Citywest Co. Dublin,1529,2019-02-06apartments-for-rent.csv
The Square  Haddington Rd Ballsbridge Dublin 4,2400,2019-02-06apartments-for-rent.csv
Wolfe Tone Lofts Dublin 1,2115,2019-02-06apartments-for-rent.csv
109 Parnell Street Dublin 1,1400,2019-02-06apartments-for-rent.csv
Wolfe Tone Lofts Dublin 1,1802,2019-02-06apartments-for-rent.csv
Herbert Park Muse Donnybrook Dublin 4,2600,2019-02-06apartments-for-rent.csv
Apt. 8 205 North Circular Road Dublin 7,1272,2019-02-06apartments-for-rent.csv
Basement Apartment 9 Ontario Terrace Ranelagh. D Ranelagh Dublin 6,2750,2019-02-06apartments-for-rent.csv
Serviced Apartments In Malahide Malahide Co. Dublin,3360,2019-02-06apartments-for-rent.csv
14 Hillsborough Laraghcon Lucan Co. Dublin,2200,2019-02-06apartments-for-rent.csv
Esker Manor Lucan Co. Dublin,1650,2019-02-06apartments-for-rent.csv
The Green Strand Street Malahide Malahide Co. Dublin,1735,2019-02-06apartments-for-rent.csv
Barrow Street Grand Canal Dock Dublin 2,2184,2019-02-06apartments-for-rent.csv
Phibsborough Phibsborough Dublin 7,1500,2019-02-06apartments-for-rent.csv
Clifton Mews Ranelagh Dublin 6,3200,2019-02-06apartments-for-rent.csv
Apt. 92 Glaslynn 97 Howth Road Clontarf Dublin Clontarf Dublin 3,1550,2019-02-06apartments-for-rent.csv
Apt. 41 Glaslynn 97 Howth Road Clontarf Dublin 3,2500,2019-02-06apartments-for-rent.csv
Apt. 28 Hanover Riverside Sir John Rogerson'S Qua Dublin 2,2999,2019-02-06apartments-for-rent.csv
22 Parkhouse Benson Street Grand Canal Dock Dublin 2,3685,2019-02-06apartments-for-rent.csv
Apt 95 Glaslyn 97 Howth Road Clontarf Dublin 3,1410,2019-02-06apartments-for-rent.csv
Tyrone House James Joyce Street Dublin 1,2288,2019-02-06apartments-for-rent.csv
Weavers Meath Place Dublin 8,1375,2019-02-06apartments-for-rent.csv
Oakhall Malahide Co Dublin Malahide Co. Dublin,2300,2019-02-06apartments-for-rent.csv
Grand Canal Square Dublin 2,3000,2019-02-06apartments-for-rent.csv
Camden Street Upper Dublin 2 Dublin 2,3200,2019-02-06apartments-for-rent.csv
Stephen St. Upper Dublin 2,3600,2019-02-06apartments-for-rent.csv
Clarendon St Dublin 2,3000,2019-02-06apartments-for-rent.csv
Dublin 2 Dublin 2,2000,2019-02-06apartments-for-rent.csv
Cows Lane Dublin 2,2000,2019-02-06apartments-for-rent.csv
Belvedere Place Mountjoy Square Dublin 1,1400,2019-02-06apartments-for-rent.csv
Apt. 3 191 Clonliffe Road Drumcondra Dublin 3,1550,2019-02-06apartments-for-rent.csv
Lansdowne Gate Long Mile Road Drimnagh Dublin 12,1545,2019-02-06apartments-for-rent.csv
Summerstreet North Dublin 1,1200,2019-02-06apartments-for-rent.csv
Cedar Square Ridgewood Swords Co. Dublin,1650,2019-02-06apartments-for-rent.csv
The Grange Brewery Road Stillorgan Co. Dublin,1560,2019-02-06apartments-for-rent.csv
Stanford Ardilea Clonskeagh Dublin 14,1643,2019-02-06apartments-for-rent.csv
Apartment 155 Bachelors Walk Dublin 1,2200,2019-02-06apartments-for-rent.csv
Glenwood Landscape Road Churchtown Dublin 14,1705,2019-02-06apartments-for-rent.csv
Belarmine Plaza Stepaside Dublin 18,1350,2019-02-06apartments-for-rent.csv
Willow Lodge Castleknock Dublin 15,2113,2019-02-06apartments-for-rent.csv
Custom House Square Ifsc Dublin 1,2400,2019-02-06apartments-for-rent.csv
Merrion Woods Stillorgan Stillorgan Co. Dublin,1910,2019-02-06apartments-for-rent.csv
Grace Park Manor Drumcondra Dublin 3,2100,2019-02-06apartments-for-rent.csv
Belleville Dublin 7,1875,2019-02-06apartments-for-rent.csv
Frederick Lane North Dublin 1,2400,2019-02-06apartments-for-rent.csv
Donnybrook Village Donnybrook Dublin 4,2000,2019-02-06apartments-for-rent.csv
Saint Aongus Court Tallaght Dublin 24,1150,2019-02-06apartments-for-rent.csv
Hanover Dock Hanover Quay Dublin 2,4400,2019-02-06apartments-for-rent.csv
Grand Canal Dock Grand Canal Square Dublin 2,3900,2019-02-06apartments-for-rent.csv
Alexandra Walk Whitefriar Street Dublin 8,3360,2019-02-06apartments-for-rent.csv
Castleway Off South Great George'S Street Dublin 2,3680,2019-02-06apartments-for-rent.csv
Castleway Off South Great George'S Street Dublin 2,3360,2019-02-06apartments-for-rent.csv
Alexandra Walk Off South Great George'S Street Dublin 2,2600,2019-02-06apartments-for-rent.csv
Alexandra Walk Whitefriar Street Dublin 8,2600,2019-02-06apartments-for-rent.csv
Hanover Dock Grand Canal Square Dublin 2,4400,2019-02-06apartments-for-rent.csv
Beacon South Quarter Sandyford Dublin 18,3196,2019-02-06apartments-for-rent.csv
Castleway Golden Lane Dublin 8,3360,2019-02-06apartments-for-rent.csv
The Aston Building Aston Quay Dublin 2,3360,2019-02-06apartments-for-rent.csv
Hanover Dock Hanover Quay Dublin 2,3800,2019-02-06apartments-for-rent.csv
Hanover Dock Grand Canal Square Dublin 2,3800,2019-02-06apartments-for-rent.csv
The Aston Building Aston Quay Dublin 2,3600,2019-02-06apartments-for-rent.csv
Alexandra Walk Off South Great Georges Street Dublin 2,3360,2019-02-06apartments-for-rent.csv
Alto Vetro Grand Canal Square Dublin 2,3900,2019-02-06apartments-for-rent.csv
Castleway Golden Lane Dublin 8,3680,2019-02-06apartments-for-rent.csv
Aylmer Rd Newcastle Co. Dublin,600,2019-02-06apartments-for-rent.csv
Forbes Quay Grand Canal Dock Dublin 2,950,2019-02-06apartments-for-rent.csv
Wyckham Point Dundrum Dublin 14,2304,2019-02-06apartments-for-rent.csv
Abbot Court Dun Laoghaire Co. Dublin,1650,2019-02-06apartments-for-rent.csv
Holywell Court Swords Co. Dublin,1648,2019-02-06apartments-for-rent.csv
The View Carrickmines Manor Carrickmines Dublin 18,1750,2019-02-06apartments-for-rent.csv
The Turrets Rathmines Dublin 6,1650,2019-02-06apartments-for-rent.csv
The Oaks Rockfield Dundrum Dublin 14,1419,2019-02-06apartments-for-rent.csv
Waterville Row Blanchardstown Dublin 15,1410,2019-02-06apartments-for-rent.csv
The Old Rectory Lucan Co. Dublin,1200,2019-02-06apartments-for-rent.csv
Orwell Place Marianella Rathgar Dublin 6,2900,2019-02-06apartments-for-rent.csv
Orwell Hall Marianella Rathgar Dublin 6,3000,2019-02-06apartments-for-rent.csv
16 Raglan Hall Clyde Road Ballsbridge Dublin 4,4500,2019-02-06apartments-for-rent.csv
Gallery Quay Block 2 Grand Canal Dock Dublin 2,3600,2019-02-06apartments-for-rent.csv
Forbes Quay Lazer Lane Grand Canal Dock Dublin 2,3000,2019-02-06apartments-for-rent.csv
Clarion Quay Penthouse Ifsc Dublin 1,4500,2019-02-06apartments-for-rent.csv
Gallery Quay Block 3 Grand Canal Dock Dublin 2,3800,2019-02-06apartments-for-rent.csv
Gallery Quay Block 8 Grand Canal Dock Dublin 2,3000,2019-02-06apartments-for-rent.csv
The Waterfront Grand Canal Dock Dublin 2,4400,2019-02-06apartments-for-rent.csv
Shrewsbury Square Sandymount Avenue Sandymount Dublin 4,3500,2019-02-06apartments-for-rent.csv
Temple Bar Square Temple Bar Dublin 2,2500,2019-02-06apartments-for-rent.csv
Lower Mount Street Dublin 2,4000,2019-02-06apartments-for-rent.csv
Longboat Quay North Grand Canal Dock Dublin 2,2500,2019-02-06apartments-for-rent.csv
Hanover Dock Grand Canal Dock Dublin 2,2500,2019-02-06apartments-for-rent.csv
Maple Hall Mount St. Anne'S Milltown Dublin 6,2490,2019-02-06apartments-for-rent.csv
Longboat Quay North Grand Canal Dock Dublin 2,2450,2019-02-06apartments-for-rent.csv
The Waterfront Drumcondra Dublin 3,1975,2019-02-06apartments-for-rent.csv
The Berkeley Pembroke Square Ballsbridge Dublin 4,2200,2019-02-06apartments-for-rent.csv
6 Chapelview Chapelizod Dublin 20,1734,2019-02-06apartments-for-rent.csv
Custom House Square Mayor Street Ifsc Dublin 1,2200,2019-02-06apartments-for-rent.csv
Wyckham Place Dundrum Dublin 14,2800,2019-02-06apartments-for-rent.csv
Orchard Square The Maples Clonskeagh Dublin 14,1900,2019-02-06apartments-for-rent.csv
Trimbleston Goatstown Dublin 14 Goatstown Dublin 14,2050,2019-02-06apartments-for-rent.csv
39 White Oaks Clonskeagh Dublin 14,1950,2019-02-06apartments-for-rent.csv
Apt.6 Quartiere Bloom Dublin 1,2400,2019-02-06apartments-for-rent.csv
Castlegrange Court Clonsilla Dublin 15,2200,2019-02-06apartments-for-rent.csv
11 Camden Lock South Dock Road Ringsend Ringsend Dublin 4,1300,2019-02-06apartments-for-rent.csv
Howth Road Clontarf Dublin 3,1250,2019-02-06apartments-for-rent.csv
Apartment Donnybrook Castle Donnybrook Dublin 4,3200,2019-02-06apartments-for-rent.csv
Sarsfield Quay Apartment Liffey Street West Dublin 7,1872,2019-02-06apartments-for-rent.csv
28 The Ramparts Cabinteely Dublin 18,2750,2019-02-06apartments-for-rent.csv
Wyckham Point Dundrum Dublin 14,1850,2019-02-06apartments-for-rent.csv
1A Killiney View Albert Road Lower Glenageary Co. Dublin,1950,2019-02-06apartments-for-rent.csv
1 Drummond House Martin'S Row Chapelizod Dublin 20,1350,2019-02-06apartments-for-rent.csv
103 Marlay View Ballinteer Dublin 16,1900,2019-02-06apartments-for-rent.csv
7 Manor House Ongar Green Ongar Dublin 15,1250,2019-02-06apartments-for-rent.csv
Liberty View  Newport Street Dublin 8,1350,2019-02-06apartments-for-rent.csv
St Pappins Road Glasnevin Dublin 9,1400,2019-02-06apartments-for-rent.csv
7 Marlfield House St. Gabriels Johnstown Road Cabinteely Dublin 18,2200,2019-02-06apartments-for-rent.csv
The Northumberlands Lower Mount Street Dublin 2 Dublin 2,2200,2019-02-06apartments-for-rent.csv
48 Rockview Simonsridge Sandyford Dublin 18,2000,2019-02-06apartments-for-rent.csv
716 Longboat Quay South Hanover Quay Dublin 2,2250,2019-02-06apartments-for-rent.csv
92 The Gallery Donabate Co. Dublin,1850,2019-02-06apartments-for-rent.csv
Coliemore Road Dalkey Co. Dublin,2695,2019-02-06apartments-for-rent.csv
The Weir 59 Orwell Park Rathgar Dublin 6,2950,2019-02-06apartments-for-rent.csv
Mount Tallant Avenue Harold'S Cross Dublin 6,1406,2019-02-06apartments-for-rent.csv
Rathgar Road Rathmines Dublin 6,1500,2019-02-06apartments-for-rent.csv
Grosvenor Place Rathmines Dublin 6,1750,2019-02-06apartments-for-rent.csv
Leinster Square Rathmines Dublin 6,1550,2019-02-06apartments-for-rent.csv
Marlborough Road Donnybrook Dublin 4,1500,2019-02-06apartments-for-rent.csv
Mount Tallant Avenue Harold'S Cross Dublin 6,1190,2019-02-06apartments-for-rent.csv
North Circular Road Dublin 7,1400,2019-02-06apartments-for-rent.csv
Landys Court Mill Street Balbriggan Co. Dublin,1250,2019-02-06apartments-for-rent.csv
Off Main Street Lucan Co. Dublin,1450,2019-02-06apartments-for-rent.csv
Hanover Dock Grand Canal Dock Dublin 2,3300,2019-02-06apartments-for-rent.csv
The Paddocks Riding Centre Woodside Road Sandyfor Sandyford Dublin 18,1050,2019-02-06apartments-for-rent.csv
The Pines Herbert Park Lane Angelsea Road Ballsbridge Dublin 4,4000,2019-02-06apartments-for-rent.csv
Herbert Park Lane Ballsbridge Dublin 4,3800,2019-02-06apartments-for-rent.csv
North Circular Road (Phoenix Park End Of The Ncr) North Circular Road Dublin 7,1450,2019-02-06apartments-for-rent.csv
Wilton Place Dublin 2,2375,2019-02-06apartments-for-rent.csv
Castle Way Golden Lane Dublin 8,2800,2019-02-06apartments-for-rent.csv
Burgh Quay Dublin 2,2000,2019-02-06apartments-for-rent.csv
Hanover Dock Grand Canal Dock Dublin 2,2900,2019-02-06apartments-for-rent.csv
Carrickbrack Heath Sutton Dublin 13,1400,2019-02-06apartments-for-rent.csv
Bow Bridge Place Irwin Street Kilmainham Dublin 8,1900,2019-02-06apartments-for-rent.csv
The Island Chapelizod Dublin 20,1900,2019-02-06apartments-for-rent.csv
Trimbleston Goatstown Dublin 14,1950,2019-02-06apartments-for-rent.csv
Bissett'S Loft Strand Street Malahide Co. Dublin,2600,2019-02-06apartments-for-rent.csv
Waterville Terrace Blanchardstown Dublin 15,1525,2019-02-06apartments-for-rent.csv
Pembroke Road Ballsbridge Dublin 4,2250,2019-02-06apartments-for-rent.csv
Rosmor Scholarstown Road Knocklyon Dublin 16,1850,2019-02-06apartments-for-rent.csv
E3 The Cobbles Dublin 8,1650,2019-02-06apartments-for-rent.csv
21.Kilkee House Clare Village Clarehall Dublin 13,1400,2019-02-06apartments-for-rent.csv
Lower Sherrard Street Dublin 1,1354,2019-02-06apartments-for-rent.csv
1 Chatham Row Dublin 2,2400,2019-02-06apartments-for-rent.csv
Booterstown Avenue Blackrock Co. Dublin,2600,2019-02-06apartments-for-rent.csv
4 Fitzwilliam Court The Rise Mount Merrion Co. Dublin,1950,2019-02-06apartments-for-rent.csv
Apt.3 Fitzwilliam Court The Rise Mount Merrion Co. Dublin,1950,2019-02-06apartments-for-rent.csv
Northumberland Road Ballsbridge Dublin 4,2000,2019-02-06apartments-for-rent.csv
Symphony House Adelaide Road Dublin 2,3000,2019-02-06apartments-for-rent.csv
Huntstown Park Huntstown Dublin 15,1100,2019-02-06apartments-for-rent.csv
Mayeston Court Finglas Dublin 11,1300,2019-02-06apartments-for-rent.csv
Custom House Square Ifsc Dublin 1,2200,2019-02-06apartments-for-rent.csv
