25 Upper Pembroke Street Dublin 2,3400,2019-02-06apartments-for-rent.csv
25 Upper Pembroke Street Dublin 2,3500,2019-02-06apartments-for-rent.csv
Capital Dock Sir John Rogerson'S Quay Grand Canal Dock Dublin 2,3300,2019-02-06apartments-for-rent.csv
Capital Dock Sir John Rogerson'S Quay Grand Canal Dock Dublin 2,2400,2019-02-06apartments-for-rent.csv
Capital Dock Sir John Rogerson'S Quay Grand Canal Dock Dublin 2,4400,2019-02-06apartments-for-rent.csv
Orwell Woods Dartry Dublin 6,2950,2019-02-06apartments-for-rent.csv
Elmwood Avenue Ranelagh Ranelagh Dublin 6,4000,2019-02-06apartments-for-rent.csv
Dunluce Anglesea Road Ballsbridge Dublin 4,3250,2019-02-06apartments-for-rent.csv
Number 1 Ballsbridge Shelbourne Road Ballsbridge Dublin 4,19000,2019-02-06apartments-for-rent.csv
Number 1 Ballsbridge Shelbourne Road Ballsbridge Dublin 4,6000,2019-02-06apartments-for-rent.csv
Number 1 Ballsbridge Shelbourne Road Ballsbridge Dublin 4,5000,2019-02-06apartments-for-rent.csv
Number 1 Ballsbridge Shelbourne Road Ballsbridge Dublin 4,5500,2019-02-06apartments-for-rent.csv
Dartry House Orwell Woods Rathgar Dublin 6,2950,2019-02-06apartments-for-rent.csv
The Crescent Building Park West Dublin 12,1850,2019-02-06apartments-for-rent.csv
Merton Hall Milltown Avenue Mount Saint Annes Milltown Dublin 6,2040,2019-02-06apartments-for-rent.csv
Forsterway Swords Co. Dublin,1350,2019-02-06apartments-for-rent.csv
Grand Canal 24 Pearse Square Dublin 2,2560,2019-02-06apartments-for-rent.csv
Whitworth Road D9 Glasnevin Dublin 9,1000,2019-02-06apartments-for-rent.csv
Whitworth Road Dublin 9 Glasnevin Dublin 9,1000,2019-02-06apartments-for-rent.csv
Adelaide Square Dublin 2,3400,2019-02-06apartments-for-rent.csv
Grantham Street Portobello Dublin 8,3500,2019-02-06apartments-for-rent.csv
Fernbank Churchtown Road Upper Churchtown Dublin 14,2350,2019-02-06apartments-for-rent.csv
Bramley Hall Diswellstown Avenue Hamilton Park Castleknock Dublin 15,2100,2019-02-06apartments-for-rent.csv
Hanover Dock Grand Canal Dock Dublin 2,3900,2019-02-06apartments-for-rent.csv
Pembroke Hall Ballsbridge Dublin 4,3900,2019-02-06apartments-for-rent.csv
Apt.47 Fishermans Wharf Ringsend Dublin 4,2200,2019-02-06apartments-for-rent.csv
The Rise Whitehall Whitehall Dublin 9,1400,2019-02-06apartments-for-rent.csv
Whitworth Road Wigan Road Drumcondra D9 Glasnevin Dublin 9,1400,2019-02-06apartments-for-rent.csv
20 Belfield Park Stillorgan Co. Dublin,2100,2019-02-06apartments-for-rent.csv
Mobhi Court Drumcondra Dublin 9,2200,2019-02-06apartments-for-rent.csv
Castle Lawns Kilgobbin Wood Sandyford Dublin 18,2200,2019-02-06apartments-for-rent.csv
Alexander Court Fenian Street Dublin 2 Dublin 2,10000,2019-02-06apartments-for-rent.csv
O'Callaghan Court Grand Canal Dublin 2,2800,2019-02-06apartments-for-rent.csv
Cathedral Court Dublin 2,2800,2019-02-06apartments-for-rent.csv
The Marker Residence Grand Canal Square Grand Ca Dublin 2,3335,2019-02-06apartments-for-rent.csv
258 The Marina Village Malahide Malahide Co. Dublin,2700,2019-02-06apartments-for-rent.csv
Northbank Apartments Castleforbes Road Dublin 1,2350,2019-02-06apartments-for-rent.csv
Northbank Castleforbes Road Dublin 1,1950,2019-02-06apartments-for-rent.csv
Beaufort Downs Rathfarnham Dublin 14,2000,2019-02-06apartments-for-rent.csv
Cranmer Lane Ballsbridge Dublin 4,2600,2019-02-06apartments-for-rent.csv
32 Millennium Tower Charlotte Quay. Grand Canal Dock Dublin 4,6000,2019-02-06apartments-for-rent.csv
Castleforbes Square Castleforbes Road Dublin 1,2100,2019-02-06apartments-for-rent.csv
Hanover Quay Grand Canal Dock Dublin 2,5000,2019-02-06apartments-for-rent.csv
North Great George Street Ifsc Dublin 1,3000,2019-02-06apartments-for-rent.csv
Hanover Riverside Hanover Quay Dublin 2,4000,2019-02-06apartments-for-rent.csv
Warrington Place Dublin 2,4200,2019-02-06apartments-for-rent.csv
Warrington Place Dublin 2,3950,2019-02-06apartments-for-rent.csv
Marianella Rathgar Dublin 6,2850,2019-02-06apartments-for-rent.csv
Clancy Quay Phase Two By Kennedy Wilson Dublin 8,2000,2019-02-06apartments-for-rent.csv
Corrig Hall Ticknock Hill Sandyford Dublin 18 Sandyford Dublin 18,2000,2019-02-06apartments-for-rent.csv
Castlepark Road Dalkey Co. Dublin Dalkey Co. Dublin,5100,2019-02-06apartments-for-rent.csv
North Great George Street Dublin 1,3000,2019-02-06apartments-for-rent.csv
Viking Harbour Usher'S Island Dublin 8,1550,2019-02-06apartments-for-rent.csv
105 Temple Court Santry Dublin 9,2300,2019-02-06apartments-for-rent.csv
Hanover Lofts Hanover Street East Grand Canal Dock Dublin 2,3380,2019-02-06apartments-for-rent.csv
Merrion Road Ballsbridge Dublin 4,2765,2019-02-06apartments-for-rent.csv
24 Donnybrook Green Donnybrook Dublin 4,2500,2019-02-06apartments-for-rent.csv
Asgard Road Grand Canal Dock Dublin 2,2900,2019-02-06apartments-for-rent.csv
No 4 Airfield Court Donnybrook Dublin 4,2000,2019-02-06apartments-for-rent.csv
Hanover Riverside Grand Canal Dock Dublin 2,3980,2019-02-06apartments-for-rent.csv
Pembroke Row Dublin 2,3940,2019-02-06apartments-for-rent.csv
Howth Lodge Howth Dublin 13,2995,2019-02-06apartments-for-rent.csv
Custom House Harbour Ifsc Dublin 1,2600,2019-02-06apartments-for-rent.csv
Sarsfield Quay Apartments Sarsfield Quay Smithfield Dublin 7,2700,2019-02-06apartments-for-rent.csv
The Pavilion Marine Road Dun Laoghaire Co. Dublin,4340,2019-02-06apartments-for-rent.csv
Shelbourne Hall Shelbourne Road Ballsbridge Dublin 4,3450,2019-02-06apartments-for-rent.csv
Skyview Vico Rock Sorrento Road Dalkey Co. Dublin,2500,2019-02-06apartments-for-rent.csv
Tramyard Apartments Spa Road Inchicore Dublin 8,2000,2019-02-06apartments-for-rent.csv
Mobhi Court Glasnevin Dublin 9,2200,2019-02-06apartments-for-rent.csv
51 Mount Pleasant Square Ranelagh Dublin 6 Ranelagh Dublin 6,2150,2019-02-06apartments-for-rent.csv
Sandford Lodge By Kennedy Wilson Ranelagh Dublin 6,2700,2019-02-06apartments-for-rent.csv
Sandford Lodge By Kennedy Wilson Ranelagh Dublin 6,2000,2019-02-06apartments-for-rent.csv
Merrion Plaza Dublin 2,4000,2019-02-06apartments-for-rent.csv
Cathedral Court Dublin 2,2300,2019-02-06apartments-for-rent.csv
Ocallaghan Court Grand Canal Dock Dublin 2,2350,2019-02-06apartments-for-rent.csv
Hawthorn Lodge Farmleigh Castleknock Dublin 15,2200,2019-02-06apartments-for-rent.csv
Block 1 Gallery Quay Grand Canal Quay Hanover Quay Dublin 2,2600,2019-02-06apartments-for-rent.csv
82 Braeburn The Orchard Leixlip Rd Lucan Co. Dublin,1550,2019-02-06apartments-for-rent.csv
The Marker Residence Grand Canal Square Grand Dublin 2,3060,2019-02-06apartments-for-rent.csv
176 Rathgar Road Rathmines Dublin 6,2000,2019-02-06apartments-for-rent.csv
Apt 90 Shrewsberry Park Dublin 4 Ballsbridge Dublin 4,3000,2019-02-06apartments-for-rent.csv
Les Buissonnets Frascati Road Blackrock Co. Dublin,2200,2019-02-06apartments-for-rent.csv
1 B Olddfarm Carpenterstown Dublin 15,1800,2019-02-06apartments-for-rent.csv
Apartment 85 St Gabriels Cabinteely Dublin 18,1900,2019-02-06apartments-for-rent.csv
Aston Quay Temple Bar Dublin 2,2500,2019-02-06apartments-for-rent.csv
Tyrconnell Inchicore Dublin 8,1550,2019-02-06apartments-for-rent.csv
Beacon South Quarters Sandyford Dublin 18,2250,2019-02-06apartments-for-rent.csv
The Grange Brewery Road Stillorgan Co. Dublin,2400,2019-02-06apartments-for-rent.csv
Vantage By Kennedy Wilson Central Park Leopardst Sandyford Dublin 18,3886,2019-02-06apartments-for-rent.csv
The Grange Brewery Road Stillorgan Co. Dublin,2950,2019-02-06apartments-for-rent.csv
St Stephens Green Dublin 2,2500,2019-02-06apartments-for-rent.csv
Semple House Ifsc Dublin 1,2235,2019-02-06apartments-for-rent.csv
15 Donnybrook Castle Donnybrook Dublin 4,2200,2019-02-06apartments-for-rent.csv
Ticknock Hill Sandyford Dublin 18,2200,2019-02-06apartments-for-rent.csv
The Northumberlands Love Lane Lower Mount St Dublin 2,1995,2019-02-06apartments-for-rent.csv
108 Wyckham Point Wyckham Way Dundrum Dublin 16,2200,2019-02-06apartments-for-rent.csv
10 Cruagh Rise Cruagh Manor Stepaside Dublin 18,2100,2019-02-06apartments-for-rent.csv
Leeson Street Upper Ballsbridge Dublin 4,2400,2019-02-06apartments-for-rent.csv
70 Milliumum Tower Charlotte Quay Dublin 4,2750,2019-02-06apartments-for-rent.csv
53 St Samson Court Balgriffin Dublin 13 Balgriffin Dublin 13,1600,2019-02-06apartments-for-rent.csv
251 Wyckham Point Wyckham Way Dundrum D 16. Dundrum Dublin 14,2330,2019-02-06apartments-for-rent.csv
Edmondstown Road Rathfarnham Dublin 14,2050,2019-02-06apartments-for-rent.csv
65 Galtrim Grange Malahide Co. Dublin,1890,2019-02-06apartments-for-rent.csv
The Sweepstakes Ballsbridge Dublin 4,2600,2019-02-06apartments-for-rent.csv
Granite Field Manor And Mews Dun Laoghaire Unit Dun Laoghaire Co. Dublin,2100,2019-02-06apartments-for-rent.csv
Greeg Court Parnell Street Dublin 1,2500,2019-02-06apartments-for-rent.csv
Cairnbrook Manor Carrickmines Dublin 18,2350,2019-02-06apartments-for-rent.csv
Charlotte Apartments Dun Laoghaire Co. Dublin,2700,2019-02-06apartments-for-rent.csv
Castleforbes Square Ifsc Dublin 1,3400,2019-02-06apartments-for-rent.csv
The Weavers South Earl Street Dublin 8,1550,2019-02-06apartments-for-rent.csv
Dakota Court  Phibsboro Phibsborough Dublin 7,1058,2019-02-06apartments-for-rent.csv
Bow Bridge Place Kilmainham Dublin 8,3000,2019-02-06apartments-for-rent.csv
Beaumont Woods Beaumont Dublin 9,1350,2019-02-06apartments-for-rent.csv
Apartment 3 Cedar House Applewood Village Sword Swords Co. Dublin,1200,2019-02-06apartments-for-rent.csv
Mountgorry Woods Swords Co. Dublin,1750,2019-02-06apartments-for-rent.csv
109 Townsend Street Dublin 2,2000,2019-02-06apartments-for-rent.csv
The Cedars Herbert Park Lane Ballsbridge Dublin 4,1850,2019-02-06apartments-for-rent.csv
Shelbourne Plaza Ringsend Road Dublin 4,7000,2019-02-06apartments-for-rent.csv
Shelbourne Plaza South Dock Ringsend Road Dublin 4,4500,2019-02-06apartments-for-rent.csv
Belfield Court Donnybrook Dublin 4,1750,2019-02-06apartments-for-rent.csv
72 Drynam Hall Kinsealy Co. Dublin,1458,2019-02-06apartments-for-rent.csv
The Atrium Island Street Dublin 8,1450,2019-02-06apartments-for-rent.csv
Haddington Road Ballsbridge Dublin 4,2280,2019-02-06apartments-for-rent.csv
Adelaide Square Dublin 2,2940,2019-02-06apartments-for-rent.csv
Adelaide Square Penthouse Dublin 2,4100,2019-02-06apartments-for-rent.csv
Adelaide Square Dublin 2,3440,2019-02-06apartments-for-rent.csv
Adelaide Square Dublin 2,2800,2019-02-06apartments-for-rent.csv
Alexandra Walk Dublin 2,3400,2019-02-06apartments-for-rent.csv
Adelaide Square Dublin 2,3240,2019-02-06apartments-for-rent.csv
Adelaide Square Dublin 2,3000,2019-02-06apartments-for-rent.csv
Adelaide Square Dublin 2,3200,2019-02-06apartments-for-rent.csv
Royston Village Lorcan O'Toole Park Kimmage Dublin 12,2025,2019-02-06apartments-for-rent.csv
Grangegorman Lower Stoneybatter Dublin 7,800,2019-02-06apartments-for-rent.csv
Elm Park House Grange Wood Rathfarnham Dublin 16,1950,2019-02-06apartments-for-rent.csv
Beechdale Court Ballycullen Dublin 24,1800,2019-02-06apartments-for-rent.csv
Custom House Harbour Ifsc Dublin 1,2300,2019-02-06apartments-for-rent.csv
Merrion Village Ballsbridge Dublin 4,2100,2019-02-06apartments-for-rent.csv
Pavillion Dun Laoghaire Co. Dublin,4200,2019-02-06apartments-for-rent.csv
Raymond Street Dublin 8,1350,2019-02-06apartments-for-rent.csv
Marianella Orwell Road Rathgar Dublin 6 Rathgar Dublin 6,2699,2019-02-06apartments-for-rent.csv
Hsq St. Johns Rd West Kilmainham Dublin 8,2300,2019-02-06apartments-for-rent.csv
The Bottleworks Ringsend Dublin 4,2195,2019-02-06apartments-for-rent.csv
25 Pembroke Street Upper Dublin 2,3400,2019-02-06apartments-for-rent.csv
1 The Cedars Monkstown Valley Monkstown Co. Dublin,2100,2019-02-06apartments-for-rent.csv
Charlotte Quay Dock Grand Canal Dock Dublin 4,2285,2019-02-06apartments-for-rent.csv
Apt. 1 St. Nessans Thormanby Road Stunning Gr. F Howth Dublin 13,1700,2019-02-06apartments-for-rent.csv
20 The Walk Robswall Malahide Co. Dublin,1500,2019-02-06apartments-for-rent.csv
Marianella Orwell Rd Rathgar Rathgar Dublin 6,2750,2019-02-06apartments-for-rent.csv
Northumberland Road69 Ballsbridge Dublin 4,3400,2019-02-06apartments-for-rent.csv
Apt. 4 Papworth Hall Georges Hill Balbriggan Co. Dublin,1000,2019-02-06apartments-for-rent.csv
Copebridge House Spencer Dock Ifsc Dublin 1,3600,2019-02-06apartments-for-rent.csv
14 Raglan Road Ballsbridge Dublin 4,3600,2019-02-06apartments-for-rent.csv
Tramway Court Tallaght Dublin 24,1650,2019-02-06apartments-for-rent.csv
Lissenfield Rathmines Dublin 6,1780,2019-02-06apartments-for-rent.csv
Emmet Place Usher Street Dublin 2,775,2019-02-06apartments-for-rent.csv
35 St. Luke'S Gate 105,1650,2019-02-06apartments-for-rent.csv
38 St. Luke'S Gate 105,2300,2019-02-06apartments-for-rent.csv
Marianella Orwell Rd Rathgar Rathgar Dublin 6,2900,2019-02-06apartments-for-rent.csv
The Courtyard Coolmine Dublin 15,1700,2019-02-06apartments-for-rent.csv
Bracken Hill Blackglen Road Sandyford Dublin 18,2300,2019-02-06apartments-for-rent.csv
Ardilaun Court Sybil Hill Court Clontarf Dublin 3,2200,2019-02-06apartments-for-rent.csv
Iveagh Court Dublin 2,4200,2019-02-06apartments-for-rent.csv
Bridge Street Grand Canal Dock Dublin 4,3900,2019-02-06apartments-for-rent.csv
Gallery Quay Grand Canal Dock Dublin 2,3450,2019-02-06apartments-for-rent.csv
Hanover Quay Grand Canal Dock Dublin 2,4250,2019-02-06apartments-for-rent.csv
Grand Canal Quay Grand Canal Dock Dublin 2,4200,2019-02-06apartments-for-rent.csv
Grand Canal Dock Dublin 2,4250,2019-02-06apartments-for-rent.csv
Leeson Street Dublin 2,4500,2019-02-06apartments-for-rent.csv
Leeson Street Dublin 2,3750,2019-02-06apartments-for-rent.csv
Grand Canal Square Dublin 2,3450,2019-02-06apartments-for-rent.csv
18 Lower Baggot Street Dublin 2,4200,2019-02-06apartments-for-rent.csv
Leeson Street Dublin 4,3450,2019-02-06apartments-for-rent.csv
Pembroke Square Grand Canal Dock Dublin 4,4200,2019-02-06apartments-for-rent.csv
Grand Canal Square Dublin 2,4200,2019-02-06apartments-for-rent.csv
The Gasworks Dublin 4,4250,2019-02-06apartments-for-rent.csv
Millennium Tower Grand Canal Dock Dublin 2,4000,2019-02-06apartments-for-rent.csv
Grand Canal Dock Dublin 2,3450,2019-02-06apartments-for-rent.csv
Lower Baggot Street Dublin 2,4200,2019-02-06apartments-for-rent.csv
Lad Lane Baggot Street Dublin 2,4200,2019-02-06apartments-for-rent.csv
Grand Canal Square Grand Canal Dock Dublin 2,3450,2019-02-06apartments-for-rent.csv
Burton House Custom House Square Mayor St. Lower Ifsc Dublin 1,3150,2019-02-06apartments-for-rent.csv
Grand Canal Square Grand Canal Dock Dublin 2,4200,2019-02-06apartments-for-rent.csv
Hanover Quay Grand Canal Dock Dublin 2,4350,2019-02-06apartments-for-rent.csv
Grand Canal Square Dublin 2,4350,2019-02-06apartments-for-rent.csv
Iveagh Court Dublin 2,4050,2019-02-06apartments-for-rent.csv
Bridge Street Grand Canal Dock Dublin 4,4350,2019-02-06apartments-for-rent.csv
Leeson Street Dublin 2,4250,2019-02-06apartments-for-rent.csv
Grand Canal Square Grand Canal Dock Dublin 2,4000,2019-02-06apartments-for-rent.csv
Grand Canal Square Dublin 2,4000,2019-02-06apartments-for-rent.csv
Leeson Street Dublin 2,3900,2019-02-06apartments-for-rent.csv
Leeson Court Dublin 4,3600,2019-02-06apartments-for-rent.csv
Grand Canal Square Grand Canal Dock Dublin 2,4250,2019-02-06apartments-for-rent.csv
Leeson Street Dublin 2,3450,2019-02-06apartments-for-rent.csv
Lad Lane Dublin 2,4200,2019-02-06apartments-for-rent.csv
Gasworks Grand Canal Dock Dublin 2,3900,2019-02-06apartments-for-rent.csv
Ballsbridge Woods Shelbourne Road Ballsbridge Dublin 4,3900,2019-02-06apartments-for-rent.csv
Grand Canal Square Dublin 2,4250,2019-02-06apartments-for-rent.csv
Bloomfield Park Bloomfield Ave Donnybrook Dublin 4,2450,2019-02-06apartments-for-rent.csv
The Oaks Herbert Park Lane Ballsbridge Dublin 4,2500,2019-02-06apartments-for-rent.csv
75 Dorset Street Upper Dublin 1,1500,2019-02-06apartments-for-rent.csv
Parnell Square West Dublin 1,2000,2019-02-06apartments-for-rent.csv
Beacon South Quarter Sandyford Dublin 18,2300,2019-02-06apartments-for-rent.csv
Kenilworth Park Harold'S Cross Dublin 6,1200,2019-02-06apartments-for-rent.csv
Clancy Quay By Kennedy Wilson Dublin 8,1700,2019-02-06apartments-for-rent.csv
Clancy Quay By Kennedy Wilson Dublin 8,1900,2019-02-06apartments-for-rent.csv
Clancy Quay Phase Two By Kennedy Wilson Islandbridge Dublin 8,2200,2019-02-06apartments-for-rent.csv
Clancy Quay By Kennedy Wilson Islandbridge Dublin 8,2300,2019-02-06apartments-for-rent.csv
Dunluce Apartments Anglesea Road Ballsbridge Dublin 4,3100,2019-02-06apartments-for-rent.csv
Lagan House Custom House Square Ifsc Dublin 1,1850,2019-02-06apartments-for-rent.csv
Penthouse The Pines Herbert Park Lane Ballsbridge Dublin 4,3160,2019-02-06apartments-for-rent.csv
Herbert Park Lane Apts Ballsbridge Dublin 4,2950,2019-02-06apartments-for-rent.csv
Circle Court Terenure Cross Terenure Terenure Dublin 6W,2950,2019-02-06apartments-for-rent.csv
Shrewsbury Park Ballsbridge Dublin 4,4100,2019-02-06apartments-for-rent.csv
Penthouse The Pines Herbert Park Lane Ballsbridge Dublin 4,4000,2019-02-06apartments-for-rent.csv
Carrickhill Walk Portmarnock Co. Dublin,1650,2019-02-06apartments-for-rent.csv
The Pines Herbert Park Lane Apartments Ballsbridge Dublin 4,2600,2019-02-06apartments-for-rent.csv
The Pines Herbert Park Lane Apartments Ballsbridge Dublin 4,2626,2019-02-06apartments-for-rent.csv
Smithfield Market Smithfield Dublin 7,1700,2019-02-06apartments-for-rent.csv
Capital Dock Sir John Rogerson'S Quay Grand Canal Dock Dublin 2,4850,2019-02-06apartments-for-rent.csv
Capital Dock Sir John Rogerson'S Quay Grand Canal Dock Dublin 2,6500,2019-02-06apartments-for-rent.csv
Millrace Walk Citywest Co. Dublin,1750,2019-02-06apartments-for-rent.csv
North Longboat Quay Sir John Rogersons Quay Dublin 2,2400,2019-02-06apartments-for-rent.csv
57 Pembroke Road Ballsbridge Dublin 4,2700,2019-02-06apartments-for-rent.csv
Off Clonskeagh Road Clonskeagh Dublin 14,1850,2019-02-06apartments-for-rent.csv
Hanover Dock Apartments Dublin 2,2800,2019-02-06apartments-for-rent.csv
Richmond Gardens Richmond Avenue Fairview Dublin 3,1525,2019-02-06apartments-for-rent.csv
The Northumberlands Lower Mount Street Dublin 2,1800,2019-02-06apartments-for-rent.csv
Wellington Lodge Ballsbridge Dublin 4,2000,2019-02-06apartments-for-rent.csv
Radcliff Hall St.Johns Road Sandymount Dublin 4,3250,2019-02-06apartments-for-rent.csv
Cabra Park Cabra Dublin 7,2300,2019-02-06apartments-for-rent.csv
Laurel Hazeldene Ballsbridge Ballsbridge Dublin 4,3500,2019-02-06apartments-for-rent.csv
114 Grianan Fidh Aikens Village Stepaside Sandyford Dublin 18,1750,2019-02-06apartments-for-rent.csv
Lower Rathmines Road Rathmines Dublin 6,2121,2019-02-06apartments-for-rent.csv
17 Roebuck Hall Clonskeagh Dublin 14,1760,2019-02-06apartments-for-rent.csv
117 Rathmines Town Centre Rathmines Dublin 6,1724,2019-02-06apartments-for-rent.csv
18 Carmichael Hall Windy Arbour Dublin 14,1664,2019-02-06apartments-for-rent.csv
The Atrium Roebuck Hill Apts Clonskeagh Dublin 14,1800,2019-02-06apartments-for-rent.csv
Moylaragh Balbriggan Co. Dublin,1400,2019-02-06apartments-for-rent.csv
The Maltings Bonham Street Dublin 8,1650,2019-02-06apartments-for-rent.csv
St Gabriels  Cabinteely Cabinteely Dublin 18,2000,2019-02-06apartments-for-rent.csv
27 Brooklands Donnybrook Dublin 4,2750,2019-02-06apartments-for-rent.csv
Viking Harbour Dublin 8,1850,2019-02-06apartments-for-rent.csv
The Sweepstakes Ballsbridge Dublin 4,2300,2019-02-06apartments-for-rent.csv
11 Herbert Street Dublin 2,1560,2019-02-06apartments-for-rent.csv
Number 1 Ballsbridge Shelbourne Road Ballsbridge Dublin 4,3850,2019-02-06apartments-for-rent.csv
Montpelier Hill Dublin 7,1750,2019-02-06apartments-for-rent.csv
Kings Hall Phibsborough Dublin 7,1650,2019-02-06apartments-for-rent.csv
Liffey Trust By Kennedy Wilson The Point Village Dublin 1,2350,2019-02-06apartments-for-rent.csv
College View Ballymun Dublin 11,1500,2019-02-06apartments-for-rent.csv
Newtownpark Avenue Blackrock Co. Dublin,1700,2019-02-06apartments-for-rent.csv
2 Harbour View Balbriggan Co. Dublin,1750,2019-02-06apartments-for-rent.csv
68 Woodview Off Mount Merrion Avenue Blackrock Co. Dublin,2100,2019-02-06apartments-for-rent.csv
Roebuck Hill Clonskeagh Dublin 14,2200,2019-02-06apartments-for-rent.csv
Wavendon 69 Northumberland Road Ballsbridge Dub Ballsbridge Dublin 4,3400,2019-02-06apartments-for-rent.csv
The Weir Chapelizod Dublin 20,1650,2019-02-06apartments-for-rent.csv
Leinster Road Rathmines Dublin 6,1700,2019-02-06apartments-for-rent.csv
Applewood Avenue West Swords Co. Dublin,1650,2019-02-06apartments-for-rent.csv
De Bret House Loretto Abbey Rathfarnham Dublin 14,1830,2019-02-06apartments-for-rent.csv
Frascati Hall Sweetmans Ave Blackrock Co. Dublin,1990,2019-02-06apartments-for-rent.csv
Wooden Buildings Exchange Street Temple Bar Dublin 2,2800,2019-02-06apartments-for-rent.csv
7A Fownes Street Upper Temple Bar Dublin 2,1900,2019-02-06apartments-for-rent.csv
120 The Oval Tullyvale Cabinteely Dublin 18,1750,2019-02-06apartments-for-rent.csv
Charles Street Great Dublin 1,1300,2019-02-06apartments-for-rent.csv
The Orchard Greenwood Estate Ayrfield Dublin 13,1400,2019-02-06apartments-for-rent.csv
Apartment One Beacon Beacon Court Sandyford Dublin 18,2450,2019-02-06apartments-for-rent.csv
Ballycullen Avenue Firhouse Dublin 24,1600,2019-02-06apartments-for-rent.csv
32 Hill Of Down Spencer Dock Ifsc D01 Hr90 Dublin 1,2456,2019-02-06apartments-for-rent.csv
Waterville Row Blanchardstown Dublin 15,2250,2019-02-06apartments-for-rent.csv
Stralem Mews Ongar Dublin 15,1500,2019-02-06apartments-for-rent.csv
Parliament Street Dublin 2,2500,2019-02-06apartments-for-rent.csv
Loreto Abbey Rathfarnham Dublin 14,2500,2019-02-06apartments-for-rent.csv
Woodleigh Ash Rathgar Dublin 6,1850,2019-02-06apartments-for-rent.csv
Rathmines Road Upper Rathmines Dublin 6,1700,2019-02-06apartments-for-rent.csv
Rathmines Road Upper Rathmines Dublin 6,1600,2019-02-06apartments-for-rent.csv
South Richmond Street Dublin 2,1380,2019-02-06apartments-for-rent.csv
Leinster Road Rathmines Dublin 6,1508,2019-02-06apartments-for-rent.csv
2 Bed Hatch Street Lower Dublin 2,2750,2019-02-06apartments-for-rent.csv
Adelaide Square Dublin 2,3600,2019-02-06apartments-for-rent.csv
Herbert Park Lane Ballsbridge Dublin 4,2450,2019-02-06apartments-for-rent.csv
Grove Park Rathmines Dublin 6,1450,2019-02-06apartments-for-rent.csv
Lagan House Custom House Square Lower Mayor Stre Ifsc Dublin 1,1750,2019-02-06apartments-for-rent.csv
Wcykham Point Dundrum Dublin 16,2250,2019-02-06apartments-for-rent.csv
Abalone The Grange Stillorgan Co. Dublin,1768,2019-02-06apartments-for-rent.csv
Carlingford Road Drumcondra Dublin 9,1350,2019-02-06apartments-for-rent.csv
Manor Street Stoneybatter Dublin 7,1200,2019-02-06apartments-for-rent.csv
Taney Court Dundrum Dublin 14,2500,2019-02-06apartments-for-rent.csv
Castledawson Sion Hill Blackrock Co. Dublin,2890,2019-02-06apartments-for-rent.csv
Inisowen Pilot View Dalkey Dalkey Co. Dublin,2100,2019-02-06apartments-for-rent.csv
Rathborne Court Ashtown Dublin 7,2000,2019-02-06apartments-for-rent.csv
Kilgobbin Wood Sandyford Dublin 18,2100,2019-02-06apartments-for-rent.csv
The Grange Stillorgan Co. Dublin,2600,2019-02-06apartments-for-rent.csv
Sarsfield Road Kilmainham Dublin 8,2500,2019-02-06apartments-for-rent.csv
Seapark Clontarf Dublin 3,1650,2019-02-06apartments-for-rent.csv
Shelbourne Village Ringsend Road Dublin 4,2000,2019-02-06apartments-for-rent.csv
Castlegate Way Lucan Co. Dublin,2080,2019-02-06apartments-for-rent.csv
92 Seamount Booterstown Co. Dublin,2100,2019-02-06apartments-for-rent.csv
The Laurels Grattan Wood Hole In The Wall Road Donaghmede Dublin 13,1700,2019-02-06apartments-for-rent.csv
Island View Court Island View Raheny Dublin 5,2031,2019-02-06apartments-for-rent.csv
Ashbrook Howth Road Clontarf Dublin 3,2000,2019-02-06apartments-for-rent.csv
The Pines Herbert Park Lane Ballsbridge Dublin 4,2600,2019-02-06apartments-for-rent.csv
The Pines Herbert Park Lane Ballsbridge Dublin 4,4000,2019-02-06apartments-for-rent.csv
The Pines Herbert Park Lane Ballsbridge Dublin 4,3500,2019-02-06apartments-for-rent.csv
Scr Portobello Dublin 8,910,2019-02-06apartments-for-rent.csv
Herbert Park Lane Ballsbridge Dublin 4,3160,2019-02-06apartments-for-rent.csv
Bloomfield Avenue Donnybrook Dublin 4,1985,2019-02-06apartments-for-rent.csv
Southmede Dundrum Dublin 16,2300,2019-02-06apartments-for-rent.csv
Bow Bridge Place Kilmainham Dublin 8,1300,2019-02-06apartments-for-rent.csv
The Amber The Grange Brewery Road Blackrock Co. Dublin,3780,2019-02-06apartments-for-rent.csv
Grande Central Sandyford Dublin 18,3220,2019-02-06apartments-for-rent.csv
Baggot Rath Penthouse Apartment Newbridge Avenue Ballsbridge Dublin 4,4508,2019-02-06apartments-for-rent.csv
Baggot Rath 2Bs4 Newbridge Avenue Dublin 4,4200,2019-02-06apartments-for-rent.csv
The Forum Sandyford Dublin 18,3220,2019-02-06apartments-for-rent.csv
Baggot Rath 3Bs5 Newbridge Avenue Ballsbridge Dublin 4,4620,2019-02-06apartments-for-rent.csv
Aikens Village Sandyford Dublin 18,2800,2019-02-06apartments-for-rent.csv
The Cubes 3 Floor 4 Beacon South Quarter Sandyford Dublin 18,3920,2019-02-06apartments-for-rent.csv
Galloping Green Stillorgan Co Dublin Stillorgan Co. Dublin,5600,2019-02-06apartments-for-rent.csv
Ridge Hall Ballybrack Glenageary Co. Dublin,5600,2019-02-06apartments-for-rent.csv
Adelphi House Dun Laoghaire Co. Dublin,3600,2019-02-06apartments-for-rent.csv
Ferncourt Stepaside Dublin 18,3360,2019-02-06apartments-for-rent.csv
Laurel Bank Lanesville Monkstown Co. Dublin,1700,2019-02-06apartments-for-rent.csv
Oak House Serpentine Avenue Ballsbridge Dublin 4,2750,2019-02-06apartments-for-rent.csv
Bracken Hill Blackglen Road Sandyford Dublin 18,1850,2019-02-06apartments-for-rent.csv
Beech House Carrickmines Green Carrickmines Dublin 18,1800,2019-02-06apartments-for-rent.csv
The Courtyard Clonsilla Dublin 15,1600,2019-02-06apartments-for-rent.csv
